[
  {
    "shard_id": "shard-synthetic-valid-a",
    "task_definition_id": "td-synthetic-alttext",
    "task_definition_version": "1.0",
    "unit_ids": ["unit-synthetic-001", "unit-synthetic-002"],
    "status": "completed",
    "version": "1.0",
    "content_hash": "sha256:0000000000000000000000000000000000000000000000000000000000000000",
    "synthetic": true,
    "lease_duration_seconds": 3600,
    "max_concurrent_claims": 1,
    "replication_factor": 1,
    "notes": "SYNTHETIC：全部 Unit 均已产生 CanonicalResult，故 completed。"
  }
]
